Tanggal Kirim;Penerima;Alamat;Kota;Telp;Kelurahan;Kecamatan;Propinsi;Kodepos;UP;Keterangan;Surat Jalan;Isi Kiriman;Jumlah Barang;Berat;Volume
01/22/2022;Putra Adnyana;Jln. dewa Anom no 103 Rendang Kab. Karangasem 80863 Bali;Karang Asem;085737070989;RENDANG;RENDANG;BALI;80863;..;.;02300370/SJ/I/2022;furniture;1;20;0
01/22/2022;Peggy Mtk;Per. Bumi Sani Permai Blok F2 No. 21 Rt.004/RW.014  KAB. BEKASI TAMBUN SELATAN JAWA BARAT ID 17510;Bekasi;081299816270;SETIAMEKAR;TAMBUN SELATAN;JAWA BARAT;17510;..;.;02300371/SJ/I/2022;furniture;2;86;0
01/22/2022;Dian natalia;Toko berkat jaya. Jl argopuro 49 situbondo KAB. SITUBONDO SITUBONDO JAWA TIMUR ID 68311;Situbondo;6281249525580;DAWUHAN;SITUBONDO;JAWA TIMUR;68311;..;.;02300372/SJ/I/2022;furniture;1;59;0
01/22/2022;adit;imam bonjol gang II no 2 Kota Batu 65315 Jawa Timur;Batu;0818529700;TEMAS;BATU;JAWA TIMUR;65315;..;.;02300373/SJ/I/2022 KURSI 59x50x24cm;furniture;2;44;0
01/22/2022;Liedya felisia;Jalan teuku umar no 33Kecamatan lumajangLumajang -;Lumajang;82245080828;JOGOTRUNAN;LUMAJANG;JAWA TIMUR;67314;..;.;02500130/SJ/I/2022;furniture;2;53;0
01/22/2022;BAPAK RUDI;PRO DESIGN MALANG JL. LETJEN SUTOYO 10-A;MALANG;03414374990;RAMPAL CELAKET;KLOJEN;JAWA TIMUR;65111;..;.;01600033/SJ/I/2022;furniture;3;135;0
01/22/2022;Heppy Wulansari;Jl. P. Sudirman no 59 Turen-Kab Malang 65175;Malang;0811296949;TUREN;TUREN;JAWA TIMUR;65175;..;.;01900082/SJ/I/2022;furniture;7;192;0
01/22/2022;Nana;Serpong garden 1 cluster Green River Blok D6 No. 22 -;Tangerang;08996999927;CIBOGO;CISAUK;BANTEN;15344;..;.;01900081/SJ/I/2022;furniture;3;80;0
