Tanggal Kirim;Penerima;Alamat;Kota;Telp;Kelurahan;Kecamatan;Propinsi;Kodepos;UP;Keterangan;Surat Jalan;Isi Kiriman;Jumlah Barang;Berat;Volume
02/07/2022;IDA BAGUS WEDA ASTAWA / 08124656530;JL GUNUNG SOPUTAN III NO 4 DENPASAR -;Denpasar;87761430080;PEMECUTAN KLOD/KELOD;DENPASAR BARAT;BALI;80119;..;.;01700039/SJ/II/2022 KURSI 77x59x23cm TELP DULU;furniture;4;132;0
02/07/2022;Nuril Hidayati;Batu Kidul Rt. 01 Rw. 09 Baturetno Jawa Tengah Kab. Wonogiri Baturetno Indonesia;Wonogiri;082220163260;BATURETNO;BATURETNO;JAWA TENGAH;57673;..;.;02300652/SJ/II/2022;furniture;3;80;0
02/07/2022;khaleda;Komplek Karang Tengah Permai TW3 no.43 kelurahan karang timur Tangerang Karangtengah Kota Tangerang 15157 Banten;Tangerang;087880088923;KARANG TIMUR;KARANG TENGAH;BANTEN;15157;..;.;02300653/SJ/II/2022;furniture;1;26;0
02/07/2022;Iwan ridwanulloh;Link dharmakusuma rt 12 rw 03 KOTA CILEGON CILEGON BANTEN ID 42416;Cilegon;6281315181388;KETILENG;CILEGON;BANTEN;42416;..;.;02300654/SJ/II/2022;furniture;1;29;0
02/07/2022;M.Siddik;Perumahan taman pinang indah blok.i no.12 Rt.05 Rw.004 KOTA TANGERANG PINANG (PENANG) BANTEN ID 15145;Tangerang;6285885562864;PINANG;PINANG (PENANG);BANTEN;15145;..;.;02300655/SJ/II/2022;furniture;1;21;0
02/07/2022;Rizky Amalia;Jl. Pam Lama No.10C (FRESH LAUNDRY) KOTA JAKARTA PUSAT TANAH ABANG DKI JAKARTA ID 10210;Jakarta Pusat;6281284210874;BENDUNGAN HILIR;TANAH ABANG;DKI JAKARTA;10210;..;.;02300656/SJ/II/2022;furniture;1;37;0
02/07/2022;PAULIN  / 0341471060;AHAMAD YANI NO26 DEPAN MASJID SABILILAH -;Malang;81944908502;BLIMBING;BLIMBING;JAWA TIMUR;65125;..;.;01600055/SJ/II/2022 TELP DULU H-1 SEBELUM KIRIM;furniture;5;76;0
