Tanggal Kirim;Penerima;Alamat;Kota;Telp;Kelurahan;Kecamatan;Propinsi;Kodepos;UP;Keterangan;Surat Jalan;Isi Kiriman;Jumlah Barang;Berat;Volume
02/11/2022;lilis komalasari;kp. arjasari no. 29 rt 001 rw 006. Dekat TK Bunga Bangsa · Arjasari Jawa Barat Kab. Bandung Arjasari Indonesia;Bandung;081220251608;ARJASARI;ARJASARI;JAWA BARAT;40379;..;.;02300736/SJ/II/2022;furniture;3;80;0
02/11/2022;Ade Romlah;an Taman Pancing Gang Rezeki No.18 Pemogan Denpasar Selatan KOTA DENPASAR;Denpasar;081238391856;PEMOGAN;DENPASAR SELATAN;BALI;80221;..;.;02300737/SJ/II/2022;furniture;1;30;0
02/11/2022;Irvan | taruh dlm pagar;Griya Permata Insani H-36 Ds. Ngingasrembyong  KAB. MOJOKERTO SOOKO JAWA TIMUR ID 61361;Mojokerto;6282139207305;NGINGASREMBYONG;SOOKO;JAWA TIMUR;61361;..;.;02300738/SJ/II/2022;furniture;1;41;0
02/11/2022;Toni atau Uma Khumairoh;Jalan Sunan Gunung Jati RW.1/ RT.2 Dusun Blobo (Kampung Dam) Desa Sukoraharjo. Kepanjen Kab. Malang 65163 Jawa Timur;Malang;081336240197;SUKORAHARJO;Kepanjen;JAWA TIMUR;65163;..;.;02300739/SJ/II/2022;furniture;4;105;0
02/11/2022;Luthfi Aldianta;Jl. Rahayu/ Gg. Aljauhari 1 RT 11 RW 03 No. 27 Kel. Kalisari Kec. Pasar Rebo Cijantung Jakarta Timur Kode Pos 13790 Pasar Rebo Kota Administrasi Jakarta Timur 13790 DKI Jakarta;Jakarta Timur;087877223718;KALISARI;PASAR REBO;DKI JAKARTA;13790;..;.;02300740/SJ/II/2022;furniture;2;52;0
02/11/2022;Ical;Jl. Tebet Barat Dalam IX C No.2 RT.003 / RW.006 Tebet Kota Administrasi Jakarta Selatan 12810 DKI Jakarta;Jakarta Selatan;083870194321;TEBET BARAT;TEBET;DKI JAKARTA;12810;..;.;02300741/SJ/II/2022;furniture;2;62;0
02/11/2022;arimatea;Jl. H muhajir perumahan cinere grove kav D.18 cinere Cinere Kota Depok 16514 Jawa Barat;Depok;087814613983;CINERE;CINERE;JAWA BARAT;16514;..;.;02300742/SJ/II/2022;furniture;1;41;0
02/11/2022;meilani sim (call 081919151123);apartement the Mansion Jasmine Kemayoran Tower Aurora JA05G Jl. Trembesi D 4 - Dukuh Golf Bandar Baru Kemayoran Pademangan Kota Administrasi Jakarta Utara 14410 DKI Jakarta;Jakarta Utara;08129026923;PADEMANGAN BARAT;PADEMANGAN;DKI JAKARTA;14420;..;.;02300743/SJ/II/2022;furniture;1;22;0
