Tanggal Kirim;Penerima;Alamat;Kota;Telp;Kelurahan;Kecamatan;Propinsi;Kodepos;UP;Keterangan;Surat Jalan;Isi Kiriman;Jumlah Barang;Berat;Volume
11/11/2021;BALIEM VILLA;JL. RAYA ULUWATU NO.34 UNGASAN JIMBARANBALI -;BADUNG;081354922288;JIMBARAN;KUTA SELATAN;BALI;80361;..;surat jalan kembali;01700313/SJ/XI/2021 TELPON DULU SEBELUM KIRIM ;furniture;5;161;0
11/11/2021;Enung;Jl. Sindangsari 3 RT 04 RW 09 no. 38 Antapani KOTA BANDUNG ANTAPANI (CICADAS) JAWA BARAT ID 40291;BANDUNG;083124192788;ANTAPANI KULON;ANTAPANI (CICADAS);JAWA BARAT;40291;..;surat jalan kembali;02305970/SJ/XI/2021;furniture;1;32;0
11/11/2021;Retno;Jl. Citra Garden City Malang Buring Kec. Kedungkandang ( Green hill/B2 52) KOTA MALANG KEDUNGKANDANG JAWA TIMUR ID 65136;MALANG;082133665756;BURING;KEDUNGKANDANG;JAWA TIMUR;65136;..;surat jalan kembali;02305971/SJ/XI/2021;furniture;2;49;0
11/11/2021;Chilot cloth;Chilot /BLE jln gunung sahari raya. ruko marinatama blok i no 8/9 samping angkatan laut.  KOTA JAKARTA PUSAT SAWAH BESAR DKI JAKARTA ID 10710;JAKARTA PUSAT;6281335403007;GUNUNG SAHARI UTARA;SAWAH BESAR;DKI JAKARTA;10720;..;surat jalan kembali;02305972/SJ/XI/2021;furniture;3;80;0
11/11/2021;Widiastuti;Desa dukuhdamu sanjar RT.03/RW.05 KAB. TEGAL LEBAKSIU JAWA TENGAH ID 52461;TEGAL;6282325400604;DUKUHDAMU;LEBAKSIU;JAWA TENGAH;52461;..;surat jalan kembali;02305973/SJ/XI/2021;furniture;2;44;0
11/11/2021;BU CITRA 08123320607;JL. IKAN PAUS I/7 RT.01 RW.08 -;MALANG;81252366680;TUNJUNGSEKAR;LOWOKWARU;JAWA TIMUR;65142;..;surat jalan kembali;00119/SJ/XI/2021;furniture;1;10;0
11/11/2021;NOVI SEPTI WIDYASARI;Dsn Gendingsari Ds Gendingan Kec.Kedungwaru Kab.Tulungagung Jawa Timur 66228;TULUNGAGUNG;81233280003;GENDINGAN;KEDUNGWARU;JAWA TIMUR;66229;..;surat jalan kembali;01901536/SJ/XI/2021 PANEL KOMPLAIN;furniture;4;172;0
